Author,Title,Review,Rating,Dates,Restaurant
"Thivi KJurong, Singapore",Friends get together,"We had an informal gathering of 'long lost' friends in April at Paya Serai. This is not my 1st time here. Over the years, i have been here many times on many variety of occasions. During this lunch gathering, similar to my previous experience, Paya Serai never failed to amaze me with the buffet spread - a real value for money. PJ Hilton has been a landmark building for decades and having a get together with friends at this landmark building is nostalgic and memorable. The staff at Paya Serai are wonderful. Rossi, Shaz, Shamsul and Ayu are among those i managed to catch up, who made our time a wonderful experience. Looking forward to our next meal at Paya Serai.Show less",5,Reviewed 16 May 2019 ,Paya Serai
Letromec,Not value for money,"Having Hi-tea on 30/12/18, RM122/pax is too expensive for that type of food provided. The parking rate was too expensive, park less than 3 hours cost me RM24.00.",1,Reviewed 31 December 2018 ,Paya Serai
"SuSankar1999Kuala Lumpur, Malaysia",Christmas eve buffet dinner- a letdown,"Recently, a friend and i went for the much hyped Christmas Eve buffet dinner at Paya Serai in PJ Hilton. I used to come here a lot a few years ago due to the selection and great tasting food. Unfortunately, the reputation has taken a severe beating in my opinion. The food selection was poor and limited. While they had the usual turkey and the trimmings (which to be fair, was nicely done) the rest of fare was quite disappointing. The taste of some of the dishes was surprisingly bad with some par ingredients. When some of the dishes ran out, it was not replenished. For a buffet service, it doesn't make sense to not replenish an item that was finished an hour and a half before the buffet closes. The dessert counter was quite pathetic and those that were served could have been given more attention during preparation. All in all, the whole thing was a waste of money. Would not recommend it again. On the plus side, The few staffs that were around, were very friendly and kind. But having said that, they were too few people working the tables. We even talked to other patrons who were trying to get someone to clear the plates and replenish water and there was only 1-2 staffs doing that. Perhaps, the mgmt should really look at restoring paya serai and other parts of of the hotel (service wise) to its glory days.Show less",3,Reviewed 26 December 2018 ,Paya Serai
"riezalKuala Lumpur, Malaysia",Late night supper,"Went down circa 10.30pm to Paya Serai for its pizza and fried rice. Fantastic service from the heart by the staff especially Farizal. Was given a surprise birthday cake too . Kudos to the Captain AKA Shahrul, Farizal & Akma !! Keep up your excellent service from the heart !! We will come back again...Show less",5,Reviewed 12 December 2018 ,Paya Serai
"Jernail RKuala Lumpur, Malaysia",Excellent Breakfast,overall excellent breakfast spread by Hilton PJ... one of the reasons i keep returning to Hilton... never disappointed Show less,5,Reviewed 15 November 2018 ,Paya Serai
"KCinKLKuala Lumpur, Malaysia",Place for a birthday celebration,"It's been many years since we last visited PJ Hilton, and I am glad to see that the hotel is as wonderful as I remember it when I was a child! We recently had buffet lunch at Paya Serai to celebrate my brother in laws birthday. We generally avoid buffets, since none of us like to overeat. However, we did our best at Paya Serai, and it helped that they had a wide variety of Malaysian food (Indian, Malay, Chinese, Western, etc), the food was delicious and good quality - various meat dishes, crab, good ice-cream (chocolate, green-tea and strawberry). There were many other diners, but it didn't feel crowded. The food was always easy to access.Paya Seri kindly brought over a piece of cake for my brother in law's birthday! They even had a clown and took some photos of the family for us. I can't recall the last time a restaurant went to the trouble of getting a cake for us.So in the end, we did overeat, and went home feeling more than satiated in more than one way!Show less",4,Reviewed 7 November 2018 ,Paya Serai
"730aaronKota Kinabalu, Malaysia",Dinner,"Nice food, good service, trainee responsible ,staff nice ,buffet tasty, really nice food,really good and really beautiful buffet.Show less",5,Reviewed 6 November 2018 ,Paya Serai
Soh M,Dinner buffet,Good place to come and relax with nice food and service thanks to allClaudiaJeanArronRoosiZammariAkmaShow less,5,Reviewed 6 November 2018 ,Paya Serai
Jean Y,Indian buffet dinner,"Good selection of food ,the Indian dessert was so good,you should remain the verriaty of dessert like this and put more malay kuih aswell,the the staff are all friendly . rossi isa ,zammari,and the student chef jeanThank youShow less",5,Reviewed 6 November 2018 ,Paya Serai
"dportelaPhnom Penh, Cambodia","Great food, amazing variety","Come for the buffet dinner and stay for the buffet desserts. From Indian to Chinese to Malaysian cuisine, exquisite dishes will tickle your palate. Top it off with some Gulab Jamun and Jelabies with Coffee for dessert and you have a near-perfect dining experience. Show less",4,Reviewed 5 November 2018 ,Paya Serai
LoveTravel828349,Dinner,Wonderful experience whereby the staff names is fariz..i really enjoy the dinner..keep up the good work.tq Show less,5,Reviewed 28 October 2018 ,Paya Serai
Pauziah J,Buffet dinner,"Very friendly, informative staff and helpfull. the food was great all the time. The chef are good in sugestion of food. Allways choose petaling jaya hilton. Show less",5,Reviewed 8 August 2018 ,Paya Serai
Muhammad H,Buffet dinner,"Woow citrawarna promotion at paya serai was great and cheerful , nice food and the verities is a bit different from before. The staff kak rossi , abang zamari and kak hasmah was helfful .Show less",5,Reviewed 8 August 2018 ,Paya Serai
"IlogjrReno, Nevada",Very busy restaurant ,This restaurant offers buffet as well as a la carts menu. Buffet offers a variety of cuisines and the menu has some great Malaysian dishes. The nasi goreng was very good! Show less,5,Reviewed 1 August 2018 ,Paya Serai
syamil f,Buffet dinner,Nice buffet with nice and frienly staff.Big thank to the leader and the staff who serve us..appreciate itShow less,5,Reviewed 31 July 2018 ,Paya Serai
Ashwin I,Excellent service during the breakfast buffet!!,"I first met Riaz on my final day of stay at Hilton Petaling Jaya and he was very friendly, polite.....he walked up to me, introduced himself and had a genuine conversation....and only after that, proceeded to serve me some fresh apple juice....I really enjoyed the fact that he took the time to introduce himself, socialize and then asked me about food instead of just jumping to the matter at hand~!...I hope you have the pleasure of meeting him and being served by him,....Thank you, Riaz, for a memorable service!!..That was the highlight of my stay at the hotel!!Show less",5,Reviewed 22 July 2018 ,Paya Serai
"vikneswary2507Kajang, Malaysia",Perfect family restaurant,"The food was just too great! The atmosphere,the service,amount of food... everything outstanding. The staff were friendly enough to offer baby chairs as soon as we walked in. Thanks alot to the staff kalpana n zammari. Definitely will come again. I have heard from my frens that Hilton hospitality thats true.. tq n good luck for all of the team members.Show less",5,Reviewed 21 July 2018 ,Paya Serai
SemerahPutihR,Nice services,"Kalpana, zammari, jais and deepika.. They give good service. And food also very nice. And nice view.Show less",5,Reviewed 20 July 2018 ,Paya Serai
PadraigS22,Gpod food and nice service,Mayur and Apet were veru attentive servers and the food tasted very good. It's authentic Malay food.Show less,4,Reviewed 20 July 2018 ,Paya Serai
Christopher H,5 Star Service,Lovely food as we ate room service most nights. Our waiter mayur and apet was very courteous and attended to every one of our needs. You truly feel like you are dining in 5-star luxury. I highly recommend Paya SeraiShow less,5,Reviewed 18 July 2018 ,Paya Serai
"RiK_DubaiDubai, United Arab Emirates",Good food and service,"Ordered food from my room. Food was very nicely presented and was really tasty. Was served by Mayur And Apet, a trainee and he was very professional, setting properly the table for me and presenting each dish. Good experience.Show less",5,Reviewed 18 July 2018 ,Paya Serai
"Bondol1524Jakarta, Indonesia",Best Ramadan Buffet!,"Best Ramadan Buffet... Big selection, Malay food, Indian food ,chinese food, western food and lots of local desert selection..well done great job for the Chef!Show less",5,Reviewed 26 May 2018 ,Paya Serai
"Nagaswari MKuala Lumpur, Malaysia",Ramadhan buffet," Fantastic Ramadhan Buffet ... the best in Klang ValleyGreat And Excellent Service ... Thank You to Fariz,Azlina,Rossi,Linda,Hasmah,Jais,Maria , SapineShow less",5,Reviewed 23 May 2018 ,Paya Serai
Parthiban_Shumugam,RECOMMENDED RESTAURANT FOR RAMADHAN 2018,"Service always great at the Paya Serai Restaurant, Hilton PJ. The staffs serves with a great welcome, greetings and excellence service especially from Mr. Maaran, Linda, Azlina, Mathiazhagan, Shamsul, Muniandy, Sharul, Rizal, Jegatheswary, Norazuar, Shazleana, Rosita Isa, Shariah, Nur Shuhada, Nizam, Arkshana and Tharmina. All of them are very efficient, energetic, motivated and giving GREAT SERVICE with smiling faces, joy, happy, fast and very attentive. Strongly recommended to experience a memorable Ramadan buffet here with your family and friends while break-fasting at Paya Serai Restaurant, Hilton PJ. Based on my experience for the past 4 years, the Ramadan buffet here is often patronized for its utmost reasonable value, with appetizers, mains, additional mains, side dishes, extra side dishes, desserts and plenty more sweet things to feast.Show less",5,Reviewed 15 May 2018 ,Paya Serai
NeriL33,Nice service,"Kalpana and Mathia got a good service.. good! Food not bad, quite some choice.. overall nice and comfortableShow less",5,Reviewed 13 May 2018 ,Paya Serai
NurzalinaL,Nice Food,"Nice food, service and environment... It’s worderful to have food here... Thanks to Kalpana, Rossi, Hasmah and Mustaffa.... Show less",5,Reviewed 11 May 2018 ,Paya Serai
Athena1310,Excellent Dining@ Paya Serai Hilton PJ,"My 1st experience to dine in paya serai was excellent and thumbs up to Rosey, Kalpana, Shahrul and Jais for serving us.Thank you .Show less",5,Reviewed 10 May 2018 ,Paya Serai
"Syah795Kuala Lumpur, Malaysia",Deliciously elegant - service,"First is location - still in the heart of Pj. The service is impeccable & we were treated with very attentive to details. From the serving of water to the discussion of the menu, recommendations to ask the staffs as they know which palate different nationalities have. Kudos to Headwaiter - Arif (sorry if misspelled), Matthia and the rest of team. We will come back.Show less",5,Reviewed 8 May 2018 ,Paya Serai
MingsK1,friendly service,"service are the best , we got special friendly staff(kalpana , Mathia ,akma & akshana) who assist us on our dining here.Show less",5,Reviewed 8 May 2018 ,Paya Serai
"atikahnoySubang Jaya, Malaysia",Birthday celebration,My birthday celebration with husbnd & baby was awesome. Suprises went smoothly. Good job to staff kalpana & others bcoz u guys are very helpful. Food also tasty & worth it. Thanks paya serai.Show less,5,Reviewed 6 May 2018 ,Paya Serai
tomas30Kuala Lumpur,Wide selection of food!,"Great selection of food at Paya Serai this evening. Choices from Malay, western, chinese, Indian as well as a wide selection of desserts made the dinner an enjoyable one.A note of appreciation to Fariz and the other staff for a great service.Show less",5,Reviewed 30 April 2018 ,Paya Serai
SaimenE2,Great service,"I would recommend this restaurant to my friend n family. The service  by the staff 'mustafa, kalpana, rais  very good. Fantastic service by the team members.. salute to Hilton PJ...",5,Reviewed 20 April 2018 ,Paya Serai
FreyaHilman,Dr Cornelia ,Enjoyed the food and coffee... the staff were pleasant and friendly..Nice place to chill with friendsShow less,5,Reviewed 20 April 2018 ,Paya Serai
"RADStaffKuala Lumpur, Malaysia",Great service ever!!,"I had dinner on 18th April with group of 15pax. Everyone was very happy & satisfied with the service provided by Shaz,fareez,Mathia,Linda,Rossi,Jega,Lyna,Andy,Nora & others staff. Not forget to chef Hardee’s for the special appetiser given. I am very happy with their serviceShow less",5,Reviewed 19 April 2018 ,Paya Serai
IzzahA84,Lunch Buffet,"The food spread was delicious and ambiance was nice..

Staff Azlina, Shaz, Rizal, Irma & Darshini was friendly and helpful. Thank you for your excellent service 😊",4,Reviewed 19 April 2018 ,Paya Serai
YenmeiL2,Buffet Dinner,"Staff Mathia, Shaz and Fareez serves us well..Good ambience will definitely be back for more ...Spacious and friendly staffShow less",5,Reviewed 18 April 2018 ,Paya Serai
nicholasxia,Beautiful restaurant,"A good restaurant with a nice ambience. Totally enjoyed the warmth and meticulous by the waiters and waitresses especially Mathia, Fareez, Akuma and Hasmah.Show less",5,Reviewed 17 April 2018 ,Paya Serai
RobinK2450,Good food and services,"We had casual dinner in paya serai restaurant. We ordered surf & turf platter and burger set. The food is superb and staff is friendly. Kudos to Mathia, Fareez, Hasmall, and Akma!Show less",5,Reviewed 17 April 2018 ,Paya Serai
anessaesya,Birthday trip,"Cames with group of people to celebrate my friend birthday..it so cool with the suprise provide from the staff here..leading from ms rossita isa, mathia, donny, akma and team from kitchen staff thank you all realy make our dinner specialShow less",5,Reviewed 15 April 2018 ,Paya Serai
IzzamS4,My dinner at paya serai,One of your staff Rossi provides me and my family a best service during our dinner last week. The food is also good and I loved it. Thank you for giving us this best service.Show less,5,Reviewed 15 April 2018 ,Paya Serai
"P Gee GKuala Lumpur, Malaysia",Great place for a family weekend get together ,"Highly recommended for its excellent spread of great food and delicacy. Fantastic team with quick service and friendly smiles always..My Thanks to En Mustaffa, Azlina, Teja, Kalpana and Fareez for making me and my family feel at home...Show less",5,Reviewed 15 April 2018 ,Paya Serai
"fredoradiontheblurShah Alam, Malaysia",Great ambience,"Cosy restaurant with a very nice qlayout. Quite a selection of local dishes. Especially love the chocolate fountain.Special shoutout to the friendly crews, Mustafa, Azlina, Fareez, Rozita, Mathia and Teja.Show less",5,Reviewed 11 April 2018 ,Paya Serai
raidaha4,Eating in this superb restaurant!,"Friendly staffs, good food, cozy environment, friendly for kids.Thanks a million to Mustaffa, Azlina, Fareez, Irma, Teja!Show less",5,Reviewed 11 April 2018 ,Paya Serai
"fahmyy2017Istanbul, Turkey",Superb service,"Very good ,friendly and helpful staff and good restaurant. Special thanks to Mustafa, Azalina and Mathia for their superb service.look forward to see all of u again soon...Show less",5,Reviewed 10 April 2018 ,Paya Serai
"Azmir HShah Alam, Malaysia",Great food and service,"The food was delicious and fresh, and the buffet was stocked well!Had a lovely warm welcome from the staff members, Mustaffa, Azlina & Fareez who provided great service as wellShow less",5,Reviewed 10 April 2018 ,Paya Serai
EllaA405,BRILLIANT ONE,"Very friendly staffs. Delicious food, and very satisfying. We are impressed by the service, we recommend Mr. Mustaffa, Mr.Azlina, and Mr. Fareez they're the friendliest staffs. It makes us wanna come back hereShow less",5,Reviewed 10 April 2018 ,Paya Serai
CheeKeongC17,Great variety of food,"Great variety of food and very friendly staff. Special thanks to Mustaffa, Azlina and Fareez for their great serviceShow less",5,Reviewed 10 April 2018 ,Paya Serai
"nisrinar2018Jakarta, Indonesia",Our reviews,"This restaurant’s service is brilliant, the foods are delicious, and we’re very very very impressed and would like to come here again-ms. Sahlah SafariShow less",5,Reviewed 10 April 2018 ,Paya Serai
vincentlms,Breakfast,"Excellent place and foods. Staffs are very nice and friendly. Especially Mr. Mustaffa, Alina and Fareez.Show less",5,Reviewed 10 April 2018 ,Paya Serai
"Razali5588Petaling Jaya, Malaysia",Superb Hospitality ,"Food, environment, staff (special thanks to Mr Farizal, Ms Rossita, Mr Mustaffa, Mr Fareez and Ms Azlina) ........... SUPERB . CheersShow less",5,Reviewed 9 April 2018 ,Paya Serai
"ClubGGGToorak, Australia",Hotel food...,"A shame as the buffet looked nice, and it was a Thai cuisine festival.There were also Chinese and Indian sections, but overall it was average.We sampled and shared several small dishes of various cuisines, and maybe the best was the Indian, with a good curry and a lamb roshgan.Good fruits for dessert as we were not tempted by the sweets.Good service from the ladies in the restaurant.Show less",3,Reviewed 22 March 2018 ,Paya Serai
"fitfunfPerth, Australia",Serai presentation ,"We were waiting to do a dinner presentation in the Krystal Ballroom upstairs. Decided to dull the hunger pangs before. Also would be busy talking during dinner. We had the mixed satay. Rendang rice. And two carrot juices. Quick speedy bite. Food arrived promptly as it was early about 530 pm. Service was excellent. Experienced waiting staff. My colleague from India really liked the trio of chicken, lamb & beef rendang served. I stuck mainly to the sweetish satay. Show less",3,Reviewed 29 November 2017 ,Paya Serai
"HazlinShahKuantan, Malaysia",Delicious meals!,"Lovely dinner today with my kids. The food was absolutely wonderful, from preparation to presentation, very pleasing. The food was fresh, properly prepared and a great value for the price.Show less",4,Reviewed 28 November 2017 ,Paya Serai
"jago sPetaling Jaya, Malaysia",Triple Birthday Celebration!!,"We booked a corner at Paya Serai for three birthday celebrations and it was a most enjoyable occasion. Excellent choice of buffet and it happened to be a Sarawak food promotion that night which was great!Staff (Shaz) organised a third cake at very short notice and overall, the attention and service we received was outstanding. Staff to seriously congratulate are Shaz, Mathia and Rossi. Many grateful thanks to all of you.Will certainly be coming back for more celebrations and dining at PJ Hilton from now on ...being PJ residents, we must support our own hotels!!Show less",4,Reviewed 20 November 2017 ,Paya Serai
"myaicenKuala Lumpur, Malaysia",Fantastic Food and Entertaining Clown. But the parking is super expensive,"Love the food. Plenty of choices of eastern and western selections. The Clown was very entertaining as well. This is unique as it keeps the atmosphere happy, cheerful and entertaining. Will definitely recommend to friends with children. But will not recommend the parking as parking is RM35! Super expensive parking ever for less than 4 hours on Saturday!Show less",5,Reviewed 30 October 2017 ,Paya Serai
"Adly MKuala Lumpur, Malaysia",Variety of food selection,"Food selections are plenty. Choices of locals, international, seafood and desserts to choose. There are a whole lamb on BBQ too. Good choice for those with big appetite. Show less",4,Reviewed 16 August 2017 ,Paya Serai
"HanifflaiKuala Lumpur, Malaysia","Ridiculous Parking Fee at this Restaurant in Hilton Hotel, Petaling Jaya","Indeed a ridiculous parking fee of RM32.00 for 4 hours even with the validation by the Restaurant! We have our family HiTea in Paya Serai Restaurant of Hilton Hotel, Petaling Jaya today, 12 August 2017. The foods are reasonably good with many variety but for the price of RM119.00 per pax which I believe that we can get better deal from other notable hotels! On top of that with such a high parking fee where we went in 3 cars, it really put me off that I don't think that I will come back again to this hotel with my family! Show less",3,Reviewed 12 August 2017 ,Paya Serai
"Steve HPuchong, Malaysia",Solid but unspectacular for the price,"We tend to hit this place once a year--probably because we forget how OK-ish it is and we are eternal optimists. It's not that it's bad-it just isn't great and for the name and the price that's not really good enough. On entering the buffet it looks like there's a lot on offer. However, once you've been around a couple of times, you start struggling. The dishes all have a certain blandness that is fairly typical of major hotels in KL. As all locals and residents know even the cheapest roadside stall will give you tastier local food. The international sections are also a bit disappointing. They look appetizing up to a point, but taste-wise there's always something missing. Might as well pop into Uncle Chillis for some western food with a bit of oomph!So, as usual our large group left wondering why we'd done it to ourselves again. The not inexpensive bill only served to ram the message home again. Will we go back? Almost certainly-but not for a while.Show less",3,Reviewed 8 August 2017 ,Paya Serai
"Wildcat7400Kuala Lumpur, Malaysia",Crowded due to Good Food!,"PJ Hilton’s coffee house has always been one of my favourites since the 90s. But it has been years since I stepped into the restaurant. However, I was fortunate enough that my companion wanted to have lunch there. So, a buffet lunch it was for the both of us.Reservation was quick & easy. We were shown to our table though we came in earlier. Traffic was good that day. I loved the ambience especially the water feature surrounding the restaurant. We were not disappointed. The spread was good & the food, tasty. No complaints there. However, the satay station was always crowded & we only managed to taste a few sticks after our desserts before they were all taken up by other customers. Also, it would be great if water is given out free flow & not limited to 1 small bottle only.Paya Serai will certainly continue to be one of my favourite restaurants & we will definitely be back again!Show less",4,Reviewed 31 July 2017 ,Paya Serai
kavitabharambe,"Good food, Excellent staff","Good food, even for a vegetarian! Staff is always cheerful and helpful. Service may be slow at times owing to the huge rush, especially at breakfast, but the hospitality more than makes up for it.Show less",4,Reviewed 11 July 2017 ,Paya Serai
"MaxManilaManila, Philippines",Good food at Paya Serai,"I had late lunch here on one of the days I was billeted in Hilton PJ. This is one of their signature restaurants located at the ground floor.Ordered nasi goreng kampung and a soda. The dish is Malay style fried rice with king prawns, chicken wings and satay. It was served with fish crackers and fried egg. Very good meal indeed. Tasty, cooked just right, especially the prawns. Meal is quite filling due to the size of the dish. Waiters were quite responsive to the requests of our group.Serving lead time though can be improved, as it took a really long time for the meal to be served. Perhaps, it was freshly cooked, but customer shouldn't be made to wait for more than 15 minutes for nasi goreng.Overall, it is worth a revisit. Show less",4,Reviewed 28 May 2017 ,Paya Serai
"evelynng14Subang Jaya, Malaysia",Paya Serai is the best restaurant i've had,"I've been to have my breakfast at Paya Serai and it's really satisfying. There are lots of live food stall(e.g: canai, pancake,etc)The chefs and interns all are nice and treat the guests well . They don't hesitate to help me when i need somethingKeep up the good work! Thank you for the nice breakfast and service you serveShow less",5,Reviewed 27 March 2017 ,Paya Serai
"faiiyattSelangor, Malaysia",Good customer service!,"I went there 2 times last Ramadhan. The food was superb nice and variety choice. The staff was very friendly, I still can recall one of staff by the name of ROSSI. She was very helpful. She helps 4 of us to connect the wifi on my handphone and took care of my 2 year old son! Paya Serai will always be in my list for Iftar.Show less",5,Reviewed 27 March 2017 ,Paya Serai
"RADStaffKuala Lumpur, Malaysia","I brought my guest to Paya Serai at PJ Hilton, the food is fanastic and we was served by Mr Andy.",The buffet is really very nice and Mr Andy who served us was really very nice. I would like recommend to everyone to try.Show less,5,Reviewed 25 March 2017 ,Paya Serai
KakiP11,Good food and excellent service,"We had dinner at Paya Serai to celebrate my friend birthday. The buffet food was good and big thank to Rossi and team for arrange the table decoration and suprise birthday cake. She highly recomended us to Chillis after the dinner. Thank you again to Rossi, she really make our day.Show less",5,Reviewed 24 March 2017 ,Paya Serai
"tunteja104Kuala Lumpur, Malaysia",MUCH BETTER,Overall I'm happy with the buffet and service provided. Big improvement from my last visit nearly 3 months ago. Keep it upShow less,5,Reviewed 24 March 2017 ,Paya Serai
"abxyKuala Lumpur, Malaysia",BEST NASI GORENG IN TOWN,Went there alone and decide to go for ala carte. The staff suggest me to try the fried rice and it really worth it. Definitely will come backShow less,5,Reviewed 15 March 2017 ,Paya Serai
wxnx,Dine in at Paya Serai restaurant,"Highly recommended asian food. Spread and good selection of food. Very nice place! Friendly and helpfulness staff. Great service and professional. Mr Suhaidy very nice person, always offering to assist us overal experience is excellent! Highly recommended lot of thanks for celebrating my fiance birthday, appreciate it!Show less",5,Reviewed 10 March 2017 ,Paya Serai
