Author,Title,Review,Rating,Dates,Restaurant
Hitomi A,Bistro a table,"Delicious food, good atmosphere and superb service. I will love it very much and definitely will come again. Recommended.",5,Reviewed 10 December 2021 ,Bistro a Table
LarryLeeFamily,Enjoyed our 15th anniversary here,"Enjoyed the food, service and ambience here. Special thanks for finding us a corner with curtains for privacy + decorating our dessert plates! Highly recommended!",5,Reviewed 26 February 2021 ,Bistro a Table
Pixel8Malaysia,Horrible first time for 4,"Decided to try out the degustation sets here for anniversary dinner on a 11.11 weeknight. Our first time here turned to be a mistake overall. Food taste was amateurish, couldnt get the mix of ingredients here there. My deluxe set's only saving grace was the grilled langoustines but that was it. Sea urchin was bad, had to reject it and got replaced with a good one. The supposedly signature lamb for mains was just rubbery and old with tendons; the mushroom sides had sand/dirt which i was crunching into, urgh. Other 3 sets were just as bad, seabass mains were bland and mushy (not fresh). Duck was bland. Fortunately the chosen Rongopai house white was good to wash it all down. Turned out the usual chef was on long break,leaving the assistants to hold the fort. Not a good risk, this is what can hurt reputations, bad timing really. Hope the other 3 tables of customers had better luck that night.Show less",1,Reviewed 16 November 2020 ,Bistro a Table
redthevirgindragon,Private and good,"Love the corner table with curtain, we got a little private area as it was a special occasion. Chef came around the table a couple of times to check up on us. The waiter was and friendly but had a bit of trouble with the communication. Had to repeat what I said a few times, but it didn't really boil me because I don't like to make a big deal about it and it was a special event. No point spoiling it. Food was lovely. Had the 4-course degustation menu, and ordered a couple of other dishes to add-on. It was lovely and not too overwhelming as we wanted a light, slow and enjoyable dinner. Duck was the star of the night and risotto was amazing. They change menu every month, so please call and ask for the latest menu. Not everyone would enjoy French cuisine, so please go with an open mind. I love it!Show less",4,Reviewed 7 October 2020 ,Bistro a Table
alvinchang88,Nice restaurant,"Very nice restaurant, superb food, nice little corner with curtain, just the right privacy and atmosphere.",5,Reviewed 29 August 2020 ,Bistro a Table
BenjaminLowK,Recommended,"Firstly, I would like to thank you for the great service (staff very alert & friendly) & the ambiance is on point. Very relaxing and romantic. So, dating port is a must!Secondly, I tried their 4 course meal. Interesting combos & the duck just melts in your mouth! Ended with choc dessert & my tummy is fulfilled. Overall, I give 4.8 /5 stars ⭐️ The 0.2 was because it’s a little pricy but if you want awesome food & service visit them. P/s: will visit them again Show less",5,Reviewed 2 August 2020 ,Bistro a Table
"yabbadoobaSingapore, Singapore",Simply amazing food and chef!,"The food here is without a doubt one of the best I have ever tasted... and that says a lot as I am a big foodie!Owner and head chef, Isadora is simply wonderful as she really tries to bring the best to the table for her diners.Show less",5,Reviewed 22 April 2020 ,Bistro a Table
"eeshuangtKuala Lumpur, Malaysia",Excellent dining,Bistro a Table was introduced me long time ago. Finally got the occasion and we decided to gain the experience and wow. Definitely a new dinner place for us in PJ for future. Great service and very nice foods. 5stars food and service 4 stars price. superb!Show less,5,Reviewed 10 March 2020 ,Bistro a Table
PooiLing,Ms Leeza,Wonderful degustation menu sampled tonight. Flavors were out of this world and complimented by exceptional presentation. The service was extremely attentive.... Highly  recommended! A+,5,Reviewed 26 October 2019 ,Bistro a Table
"Fun8888Kuala Lumpur, Malaysia",Huge Disappointment ,We had high expectations especially experience chef Isadora at Antara Restaurant which we fondly remembered. Thus the reason for trying Bistro a Table. The ambience is great & the service is excellent. We had no issue with the degustation 4 meal couse but the ala carte Roasted quail stuffed with foie gras & truffle cream was given half cook where the rawness can be seen. Sent it back unfortunately towards the end of the same dish it was also not cooked properly.Certainly we will not come back .Show less,1,Reviewed 23 September 2019 ,Bistro a Table
"EnglishGarden12Selangor, Malaysia",Perfect for a romantic date night ,"My partner and I went to Bistro a Table last Saturday night for a treat on date night.He chose one of the 6 course taster menus, whilst I had the baked French onion soup followed by the seabass. I have to say the soup was absolutely the best onion soup I have ever had and all the food was cooked to perfection!We really appreciated the fact that chef Isadora came to our table to take our orders, talked us through the menu and come back to us several times throughout the evening to discuss the food. We had also notified the restaurant in advance of my garlic intolerance and Isadora was so informative and helpful, offering suggestions and ways she could adapt the menu for me.The ambiance of the restaurant was romantic, private and quiet - perfect for a romantic evening.Honestly, I’ve lived in Selangor for two years and I think it’s my favourite restaurant in PJ! Delicious.Show less",5,Reviewed 4 September 2019 ,Bistro a Table
Kevin010912,Hidden Gem,"Celebrated our 7th wedding anniversary here, and have to say wee were not disappointed. 
The food was excellent and the service was warm and efficient.
Will definitely be back.",5,Reviewed 1 September 2019 ,Bistro a Table
Andrew D,"Our first visit to Bistro a Table, PJ","Warning - this is an in-depth review of the food and ambience at one meal......This was our first visit to Bistro a Table, planned for some time after learning about Chef Isadora and her standard of excellence, and finally it happened. We do not eat meat, but there was still enough choice of intriguing looking dishes to tempt us. For starters we chose the smoky tomato soup (with potato cloud!) and the stuffed zucchini flowers, and they were both excellent, the soup especially so with its unique flavour and presentation. The mains chosen were the truffle risotto and grilled seabass, with a delicious artichoke salad and a simple green salad as side dishes. I say simple, but in fact it is quite difficult to actually get what should be a simple green salad with a proper dressing, generally they have a poor choice of salad leaves, and tomatoes and other vegetables added, and then little or no dressing (or something sweet...) which shows the chef has no real idea about what constitutes a green salad - or has handed it over to the kitchen junior to prepare...... all that is wanted is a variety of fresh young green salad leaves and a simple french dressing (not sweet!), and that makes a perfect green salad....and happily, finally, this is what we had at Bistro a Table. Most do not get this; Chef Isadora clearly does. I have rather focused on this simple dish, because it is so unusual to get it properly prepared, and demonstrates very effectively the quality, competence and attention to detail of this kitchen.The artichoke salad was recommended by the chef, and certainly did not disappoint; it was loaded with flavour and texture: mushrooms, artichoke (of course) and crunchy celery, in its own unique dressing, and we intend to recreate it at home if we can, it was so good.The grilled seabass is uncomplicated, and just needs to be cooked perfectly to be - well, perfect - and it was, delicious. Precisely judged cooking of fish is an art....I have saved the truffle risotto until last, because, my word, it was good! A wonderful rich, creamy concoction of perfectly cooked rice with an intense truffle component, bursting with complex flavours, and was probably the best risotto we can remember tasting. No more words needed...With great regret we concluded we had no room to do justice to the dessert menu, a huge disappointment, and if there is any criticism at all, it is that the dishes are a tad too generous.....you don't want to leave anything, but then you (we, anyway) have little room left for dessert....not recommended at all! Chef Isadora came to our table several times during the meal, which is in any case, made our visit a memorable experience, but finally wanted to know why we had not chosen a dessert(!) - on our next visit (and there most certainly be one) we intend to ensure room will be reserved for dessert(s).....Related to the meal, we had several glasses of wine (we prefer white), and the wine quality certainly enhanced our experience. Not forgetting the quiet competence of the service, which was everything you could hope for, this was made extra special with the Chef's visits to our table to discuss food (and desserts!).The restaurant itself is easy to find, and exhibits a delightful clean, understated excellence inside, with unusual lighting and an interesting variety of unique framed posters (I suspect selected by Chef Isadora herself - if you see them you will understand why I say this!). Also it needs to be said; most French restaurants (in France) have disposable paper table covers, which makes obvious sense for diners that love to eat - and we were very pleased to see this in Bistro a Table. It is perhaps a small matter, but simply adds to the whole experience, and makes you appreciate the professionalism of the Chef and her intention to provide a true french ambience in quiet PJ.Overall, the thing that most stands out is the quality of the ingredients - if these are not first class, nothing else can be. Happily the quality stood out in all respects, and this is a jewel of a restaurant to have in a quiet suburb, and within 10 minutes drive of our home too! As a final note, we had no problem to safely park nearby, in fact the whole commercial area is well organised for parking, considerably better than many places in KL.Show less",5,Reviewed 26 August 2019 ,Bistro a Table
hasimrozana,Excellent finding in the neighbourhood.,"Last Thursday 30.05.2019 was an excellent finding for my family. We was greatful for our decision to try at this restaurants. Delighted from our 1st step in. Cosy ambient, friendly staff and super satisfy on the food. Presentation and timing from starter till dessert was perfect. Excellent recommendation and explanations by Chef Isadora. We also learn something new in this business..I can imagine holding private function in the restaurant!! Most important, price was very reasonable. We was happy from start till end.. Will definitely will come back to try the other dishes in the menu..Show less",5,Reviewed 2 June 2019 ,Bistro a Table
"Khairun NKuala Lumpur, Malaysia",Hidden gem of french cuisine,"We booked via website and when we arrived found out we were the only patrons for lunch. Very quiet area which we appreciated. Service was very polished. Food was rich and definitely had the French character. We felt the price was very reasonable compared to restaurants in hotels especially in busy KLCC areas. All in all, we had a great experience and hope to come again.Show less",5,Reviewed 2 May 2019 ,Bistro a Table
Woeihern,"Romantic, cosy, personal",A great place in the neighborhood for some fine dining. Say hi to chef Isadora. Lots of regulars have turned into friends. Perhaps that's the secret sauce to its beautiful menu,5,Reviewed 24 March 2019 ,Bistro a Table
"blujasAmpang, Malaysia",Great creations French cuisine ,"Our 16th wedding anniversary was celebrated here. There are many good things about this place - the creativity in the foods, the tastiness, the very cosy design and the attentive service we received from Maitre’d Faisal was impeccable from reservation to the end of our dinner that night. We did have a great time! The only two constructive comments which I would put in here are 1. The pan fried sea bass’ skin was a tad soft and 2. The restaurant gave us a nice designed writing on our dessert “happy 16th anniversary”. However, the dessert wasn’t complimentary. In most of our anniversary years celebrated in other restaurants around the world, we tend to receive a nice surprise from the restaurants we celebrate it. In fact in some, we received complimentary champagne or desserts or sweets. Lastly, I find it odd that the chef came out to greet a table with many ladies celebrating their friend’s birthday, however she didn’t feel it important to come ask how we enjoyed ourselves that night. There was perhaps just three tables including ours that night. Show less",4,Reviewed 1 March 2019 ,Bistro a Table
Navin K,Romantic and quiet,"Celebrate my first anniversary here. The menu, service and the environment was unique and was very memorable.",5,Reviewed 18 February 2019 ,Bistro a Table
Raylim008,C'est Bon!,"Had a great gastronomic experience with Chef Isadora. Food was amazing, plating was creative and service was good. Great wine selections but be prepared to splurge if you're planning to have some. Would be great to have a few special cocktails based on menu themes? Overall, if you're looking for somewhere romantic with some private space, book early for the private couple table. Deco option recommended. We had a great time and definitely would be back again for their special themed degustation menus!Show less",5,Reviewed 17 February 2019 ,Bistro a Table
Ednaconda,Birthday celebration,"Celebrated my partner's birthday last night at Bistro à Table. It was our first time here and Chef Isadora made it memorable for us! Thanks Chef!! Hats off to the most down-to-earth chef ever! She's so hands-on! Also, kudos for their exceptional service. Very attentive staff. We enjoyed our food very much, it was a great experience for us and we'll definitely visit again! Much love. xShow less",5,Reviewed 16 January 2019 ,Bistro a Table
Lovetotravelpj,A fine dining experience,"This is a place for environment, services and reasonable price fine dining experience. It is good for some special occasion kind of dining experience.",4,Reviewed 17 September 2018 ,Bistro a Table
pohe226,French restaurant with great ambience,"This is a gem hidden in Seksyen 17 PJ. Best to reserve before you go because seatings are limited. I liked the fact that they have curtains to partition the tables, giving people more personal space. On the other hand, the downside is it becomes difficult to catch the waiter. Ordered the degustation menu. I loved the Entree but the mains was slightly disappointing because it was kind of plain when compared to the Entree. However, the dessert helped to end the dinner on a high note! Service was rather slow tonight but it was an enjoyable time that we had in the restaurant. Show less",5,Reviewed 4 September 2018 ,Bistro a Table
Swee Kee L,Good food and wine,Really enjoyed my first visit to a Table. Missus loves the food and wine on the eve of her birthday.,5,Reviewed 11 August 2018 ,Bistro a Table
Eric L,Romantic and Nice Restaurant,Bump into the restaurant without any planning initially. Just got attracted by the outlook. After trying the food and dessert it's really nice and the service from the restaurant crew was polite and friendly. Special credit to Faisal and Joe for the good and friendly service.Will definitely recommend to my friends and family! Show less,5,Reviewed 1 August 2018 ,Bistro a Table
HoC552,Romantic atmosphere,The food is awesome!Nice French dining & love the pavlova!! Great hospitality & service from Faisal & the team! 👍👍,5,Reviewed 1 August 2018 ,Bistro a Table
Desmond K,Dining,"The food was great and delicious. Tks Faisal , Raj N Joe for the serving. Friendly and smile all the way... Bravo!",5,Reviewed 25 July 2018 ,Bistro a Table
aimanh245,Hidden Gem In Petaling Jaya,Great introduction of the menu from thr Chef/Owner itself.Wonderful choices of entree’s which was a new experience for both of us and had with a great taste.The rosted quail stuffed with foie gras was excellent.have not had an experience eating like that before but it was good.Overall nice french cuisine setting for a private moment with ur loved ones and proper introduction of the food by the chef itself.5 stars!Show less,5,Reviewed 15 July 2018 ,Bistro a Table
Khalisah K,Awesome,"Had our anniversary dinner here with scallops ceviche for entree, NZ lamb with lamb trimmings for mains which tasted awesome. Loved how the owner took her time to explain the menu herself. Great ambience also. For Muslims, all meats are halal except for the wagyu & red wine beef. You have to also request for alcohol free dishes. I loved how the owner understood our needs as Muslims. Awesome pawsome.Show less",5,Reviewed 15 July 2018 ,Bistro a Table
StevenB5289,Lovely place for birthday dinner,"Food was tasty and beautifully garnished. Ambience was cosy and warm with soothing romantic french music in the background. The service is good and all are friendly. The chef even personally served us the birthday cake, which was very rich in chocolate....so full that we couldn’t finish and Chef helped us to take away home. We will come again for sure .....Show less",4,Reviewed 15 July 2018 ,Bistro a Table
WilliamChua,Fine dining at casual setting,Good experience. Service is attentive. I had vegetarian which is good. There`s the degustation menu as well as the ala carte menu which has a selection of vegetarian options. An excellent choice if you want a romantic dinner or some quiet time with loved ones.,4,Reviewed 10 July 2018 ,Bistro a Table
hooichie,Great place for dining ,"Great environment, served with flavoursome and delicious French cuisine. Definitely will revisit again ☺️",5,Reviewed 28 June 2018 ,Bistro a Table
DovenX,If you are serious about food. Go there if you appreciate an amazing tastebuds experience.,"For people with discerning palate. All the dishes are designed to bring out the flavors of the ingredients The zucchini flower with cheese was crispy from the outside, creamy from inside; overlay with tarty salsaThe signature egg was superb. Veal appetizer was wonderfully executed.Lamb was amazingly done, tender and If Pakistani mango is in season, definitely order the pavlova Honestly, wholesome food with a wonderful crew. You can tell the owner and chef is very particular and strive for perfection!Show less",5,Reviewed 26 June 2018 ,Bistro a Table
WuiGiapS,Very nice,Good tasty food with a nice environment. Some of the food is rather normal with the price but the taste was nice.,5,Reviewed 23 June 2018 ,Bistro a Table
Toksvig,Neighbourhood gem,"A rarity in Kuala Lumpur - a European restaurant, which is serious about produce and classical techniques. All at neighbourhood prices. The owner served our table in person, which was a wonderful touch - she's charming and knowledgeable about food and wine.The room is super cosy and tastefully decorated.Execution was excellent all around. My only niggle was the beef marrow risotto, which I found a touch too rich and cloying. Would have benefitted from an acidic element to cut the fattiness. Mango pavlova was mindblowing....To quote Arnie: ""I'll be back!""Show less",5,Reviewed 21 June 2018 ,Bistro a Table
carsam ckuala lumpur,Memorable Father's Day treat,"Had a lovely surprise when the last dish came with an inscription ""Happy Father's Day"" on the plate. We had lobster, white asparagus truffle,& mango pavlova which was very good.Excellent service & recommendation by Faisal, Raj & Joe.They also gave a Happy Father's Day complimentary drink. Check it out.Show less",5,Reviewed 17 June 2018 ,Bistro a Table
mishkie7,Fun experiential dessert! ,"Came for coffee and desserts. Had a lovely papaya pie and something called a mindscrew, which was a fun experiential dessert that turns sour into sweet.",4,Reviewed 5 May 2018 ,Bistro a Table
aquacic,beautifully presented desserts,"i had the thin crusted papaya pie and my friend was recommended the mindscrew dessert and wow ..it was delicious and definitely a fun experience.
place was cozy and super friendly chef and staff. highly recommended.",5,Reviewed 5 May 2018 ,Bistro a Table
jiachengl2018,Valentine’s Day dinner,"Environment is really good for the event. Mains were lamb and quail. The medium done lamb is really good, juicy and sweet.

Coffee might sound strange for dinner but the beans are good.",4,Reviewed 14 February 2018 ,Bistro a Table
"FredericBlancBordeaux Saint Clair, France",Honest Review .,"Produce were source well ! Some of their produce such as proteins could be seen very fresh . But cuisine here lack identity and confidence . Food were fine ! But for high prices , it should set this bistro apart from the rest. Interior looks beautiful. Show less",3,Reviewed 17 January 2018 ,Bistro a Table
Patch S,Interesting french local food,"creative french food with a local twist. ;) Recommend the mac and cheese, tiramissu and claim pasta.",4,Reviewed 31 December 2017 ,Bistro a Table
"Sim Eng NKuala Lumpur, Malaysia",Birthday treat,"Since our last visit more than a year ago, we were curious as to what the ever inventive Chef Isadora has been concocting. Apart from the usual suspects, there are a few new dishes added to the menu, one of which was Sabah rock lobster cappellini, which didn't disappoint. If you live around PJ and would like to enjoy fine - dining without the fuss, take a chance at Isadora's Bistro á Table. She may just surprise you with a few twists to familiar favourites. Show less",4,Reviewed 29 December 2017 ,Bistro a Table
aishahi2015,Birthday Dinner with Besties,"Excellent food & fresh refined flavours! Unpretentious setting..definitely a hidden gem.
Looking forward to more memorable visits..",5,Reviewed 23 December 2017 ,Bistro a Table
Antoine KPort Louis,Dinner @Bistro a Table,"Tuesday evening. Only 2 table occupied. Starters n desserts were very good n inventive. Main course was rather average for what I expected to be a very good restaurant, having ranked in top 20 restaurants of KL as per CNN Traveller.Service was average taking into account that only 2 out of about 15 tables were occupied at the time. Wine list was limited. I had a bottle of Chardonnay which was reasonably priced n good quality, the only Chardonnay on the menu.French/Fusion food, atmosphere is promising if more tables were to be occupied.Might give it another try at the weekend when it is likely to be more busy.The sister restaurant in downtown KL look more hip!Show less",3,Reviewed 1 November 2017 ,Bistro a Table
KerryGoldQatar,Excellent French restaurant,"While a little off the beaten track, this is an excellent find for anyone who loves French food. We look forward to returning soon!",5,Reviewed 17 October 2017 ,Bistro a Table
ChristopheKL,Pleasant evening,Interesting dishes and a very nice surprise although we were already told many good words about this restaurant. Highly recommended.,5,Reviewed 28 May 2017 ,Bistro a Table
sharonsaw,Delightful degustation ,"I had a gorgeous degustation dinner at Bistro a Table. The flavours were varied and tasty, portions reasonable, and service attentive. Although chef Isadora was not in that evening, the food was still presented well and delicious.",4,Reviewed 12 May 2017 ,Bistro a Table
"330premkKuala Lumpur, Malaysia",A great accidental find !!,"Took my wife for an anniversary dinner to the neighbourhood. We actually wanted to dine at Soleil, not realising that Soleil had shifted to their new place. Decided to give Bistro a Table a try . We were initially apprehensive as the restaurant was empty. We shouldn't have worried as this is a very good restaurant ! we tried the deluxe degustation menu, and it was excellent. The portions were just the right size. The starter which was the coddled egg with truffle with the asparagus was exquisite. The pasta was very very good...Their wine was also very good. The service was exceptional too...This restaurant is a wow for me....Show less",5,Reviewed 17 November 2016 ,Bistro a Table
"jermpinsKuala Lumpur, Malaysia","Good food, and service; but small serving portion","I had the deluxe degustation menu. Food was decent but not WOW. Food serving portion is on the small side. First course: coddled egg with truffle, served with asparagus - decent. Second course: ricotta cheese wanton served in beef consomme - really good! The beef consomme was perfectly flavoured, and worked really well with the ricotta cheese filling. Third course: kobe beef tartare, served with endive and toasted hazelnut - really good, the beef worked especially well with the toasted hazelnut.Fourth course: rabbit sausage, served with braised leak - portion was too small for a main. Not the best rabbit dish I had. The braised leak however was perfectly done and seasoned. Dessert: caramelised banana bavarois, served with dulce de leche ice cream - nothing special.The service, on the other hand, was exceptionally good. Show less",3,Reviewed 16 September 2016 ,Bistro a Table
Mariza A,A Gem! What A Treasure!,"This place has better food and service than many fine dining places in KL-PJ. This is no mean feat considering that there are many really excellent French restaurants around. The ambience is very relaxed and casual. And I had a fabulous meal and a fantastic time without being surrounded by pretentious, self-conscious diners! It was such a treat to be able to enjoy a beautifully crafted meal in such a relaxed atmosphere!And the food really is divine!The food and the service are well worth the visit! Highly highly recommended!Show less",5,Reviewed 8 August 2016 ,Bistro a Table
