Author,Title,Review,Rating,Dates,Restaurant
charlize59,nice Jap food and ambience,This restaurant is tastefully designed from a bungalow.  Food is good and service too. Sashimi is free and their lunch and dinner sets are good too.  Love their unagi roll and toro soup.  Salads and temaki are good too.,4,Reviewed 28 December 2016 ,Ishin Japanese Dining
"tommyfangSingapore, Singapore",Good food friendly service ,Had a wonderful time here at Ishin . The staff are all very friendly and willing to help . Much better than expected. Sashimi is fresh and uni is perfect . The 3 eggs chawamushi is a must try . The tempura is well battered . Well done Show less,5,Reviewed 27 December 2016 ,Ishin Japanese Dining
"S Kheong FPetaling Jaya, Malaysia",Review,"I am currently at Ishin Japanese Dining and we had a delicious dinner consisting of sashimi, teppanyaki, rice, miso soup, local fruits and green tea. The portion size was good although slightly pricey. There was a bright and friendly ambience with decorations on the walls reminding me Japan such as the pink cherry blossoms, Mt. Fuji and various others. I like the fact that we could see the chef cooking and slicing in front of us proving the freshness of the food served.The place is well conditioned and overall it was a great dining experience. Service was good and the restaurant could sit a large group. Show less",4,Reviewed 26 December 2016 ,Ishin Japanese Dining
juliana g,"Small Cozy Outlet, Food met expectations","Its is housed in a semi D bungalow. Parking is easy. The food was within expectations, but no 'wow' factor to it. Make reservations.",4,Reviewed 21 December 2016 ,Ishin Japanese Dining
"eclipse21stPetaling Jaya, Malaysia",Simply excellent,"When having sushi, it's freshness and grade would be of highest priority and Ishin Japanese Dining truly did not disappoint! I have a habit of coating my sushi with a thick layer of wasabi mixed sauce, however that wasn't the case when I had my sushi here. The food were already really good on its own that added sauce wasn't necessary. Highly recommendedShow less",5,Reviewed 18 December 2016 ,Ishin Japanese Dining
Kiteleong,Teppanyaki sauce is oily and tasteless...,"The seafood teppanyaki set is totally disappointed.. anyway the presentation is good, the taste have long-way to improve",1,Reviewed 16 December 2016 ,Ishin Japanese Dining
"Lettecia87Kuala Lumpur, Malaysia",A pleasant celebration,"We had recently frequent Ishin for a birthday celebration, mainly, we choose the place as we are big fans to the Japanese cuisine. Truly, Ishin did not disappoint. Food was really fresh and they have rare offering of Sea Urchin and others, portion was just great to satisfied our craving. Not only the shashimi, the cooked food was equivalently good too, we had yummy dishes of teppanyaki and baked cheese oyster, yum!Ambiance was not too bad too, it is comfortable and slightly romantic with tea candles presence on every table. Staff service is good, they are attentive, friendly and helpful. I personally thinks the price is alright for the quality that was offered.Overall, it was a good date. We had a really good evening. PS. Do make reservation as they are always packed in the evening.Show less",4,Reviewed 28 November 2016 ,Ishin Japanese Dining
sumnic,"Good service , good food","Very nice & big potion for japanese meals, important is.... Taste very very very yummy !! Actually i visit this restaurant to celebrate birthday with colleague, we so suprise when all waitress is singing the birthday song & some body carry guitar (playing the song for birthday) , and my colleague was so happy and unforgettable ~~Good service !! Yummy Food!!Show less",5,Reviewed 15 November 2016 ,Ishin Japanese Dining
bgck,"Good service, good food","Very good and polite service from waitress, recommended is very fresh and delicious sashimi set. Highly recommended sashimi set. We went there a couple, perhaps should have picked a more quiet corner for conversation.price is reasonable for such high quality Japanese foods.",4,Reviewed 7 November 2016 ,Ishin Japanese Dining
Jiayee Y,Waiter cleared my plates before I finish my food,"The food here was overrated, the ambiance in this restaurant is good but the services can be improved as the waiter did not understand what I say and they did not ask us before they cleared our plates.Show less",2,Reviewed 29 September 2016 ,Ishin Japanese Dining
KentTai,Birthday celebration with my lovely wife,"Excellent food, excellent service! Is a good place to enjoy food. Good environment with free jockey service .",5,Reviewed 28 September 2016 ,Ishin Japanese Dining
Choi Y,Overated,"I was visiting this restaurant with high expectation. However was very much disappointed with the food quality based on the price and reviews given.Food tasted moderate. Service was moderate too as most staff are immigrants from neighboring countries hence communication is moderated but communicable. But given the recommendations as Japanese fine dining, i guess I m expecting more. I ordered a sukiyaki. The beef served was fresh but not top quality as claimed. Half way through the meal, to my horror I found myself chewing through a cooked plastic piece hiding in between the vegetable fished out from the sukiyaki.As I was highlighting the issue to the staff who as confused as I am, resulting a feeling of ""should i complete my meal to satisfy my craving"" or ""should i pay and leave""After 10 mins,the staff told me that chef explanation is the plastic is from the beef wrapper and that I don't have to pay for my meal. I thank him for the explanation but end of the day is not that we don't have to pay. Is that you acknowledge the mistake made. Feeling confused I just left abruptly. No one bother to apologies. I guess Sakae sushi or Sukiya would have given better service.Show less",2,Reviewed 23 September 2016 ,Ishin Japanese Dining
Catherine C,Wonderful dining experience,The kaiseki set was creative & taste really good! Service was attentive and polite. We enjoyed it very much!,5,Reviewed 18 September 2016 ,Ishin Japanese Dining
"sakthinKuala Lumpur, Malaysia",A good place for fresh japanese food,"The seafood was fresh, the presentation of the food was neat and nice. A gentlemen in the restaurant was kind enough to explain on the food and drinks and even informed us when we ordered too much. The waiting staff were very attentive and the price was reasonable. If you are ordering the bento set which is quite a large portion, side dishes are not necessary.Show less",4,Reviewed 13 September 2016 ,Ishin Japanese Dining
plisney,Enjoyable,A most enjoyable find. Good quality Japanese food but I would not refer to it as $$ as trip Advisor did. More like $$$. Alcohol over-priced so sinners suffer.,5,Reviewed 11 September 2016 ,Ishin Japanese Dining
"BenMoraisPetaling Jaya, Malaysia",An exceptional Japanese restaurant,"My party of seven visited this restaurant for lunch recently. The place was fairly crowded but we were given a table after a wait for five minutes.We ordered a number of sushi dishes, some being quite unusual and exotic. We also ordered chawan mushi, two portions of seafood fried rice for the children in the group and some warm Japanese tea.The sushi dishes were delicious, especially the one with sea urchins.The service staff were good at their job as well as being alert. When a child spilled a drink, before we could say anything, a wait staff was on hand to mop up the liquid and clean the table. And that too with a smile on her face. Our tea cups too were regularly topped up.Show less",4,Reviewed 28 August 2016 ,Ishin Japanese Dining
"choywanCheras, Malaysia",Reasonable price with food & environment ,"I made a reservation for my hubby's birthday celebration (knowing that it's always pack during weekend). Considerate service with cozy environment, seating is rather crowd though compare with other Japanese restaurant. Food is tasty with reasonable price. We like the fresh and delicious Unagi the most. ( the knife for otoro might be not sharp enough? Not sure) Would definitely pay another visit again. Show less",4,Reviewed 21 August 2016 ,Ishin Japanese Dining
DecO18,FOOD IS GOOD.,Need early reservation for dinner. If do not make any reservation do have dinner as early as you can. Staff working here is quite friendly.,4,Reviewed 17 August 2016 ,Ishin Japanese Dining
juliat39,Food food,Set lunch offer: 2 sets with 1 free. Good value. Food with good quality. Pleasant environment and excellent service. Would recommend.,5,Reviewed 15 August 2016 ,Ishin Japanese Dining
"CrystalismKuala Lumpur, Malaysia",Good quality Japanese food for a reasonable price!,"Good quality Jap food for a reasonable price!!! I never expected their quality to be that good considering the average pricing but everything we had ordered were great. Except for the beef which wasn't so good in quality so they took it back and removed from the bill. It's not fine dine standards but it's good for special occasions. Would recommend if you're looking for affordable Jap food. Service is pretty slow so better don't make too many plans for the night. Also, it is a must to make a reservation otherwise the waiting queue is very long.Parking is limited but there's a valet. We took a cab there anyhow. Show less",5,Reviewed 1 July 2016 ,Ishin Japanese Dining
"21meiwKuala Lumpur, Malaysia",Japanese fine dining at the suburbs ,"This is my first visit to this Japanese restaurant and was looking forward to it after seeing the online rave reviews. Strange considering that I lived in homes situated along Old Klang Road for most of my childhood until early adulthood, I've never been to IshinLet's start with good stuff :-Excellent presentation especially for the kaiseki which can rival the top restaurants in the city. The igloo that housed the sashimi was a nice touch. The kids loved itFreshness - which is arguably the key to Japanese food was great . In particular the sashimi Kampachi was fantastic (although no toro or even maguro was included in the sashimi course, a little disappointed ) Price - although not cheap but will not empty your wallet . For the quality , it was deemed reasonable Bad stuffCleanliness - the exterior and the front part of the dining area was impressive but however as we were given a private room, we have to go behind and up a narrow staircase near the kitchen. The area around the staircase was untidy and dirty . The management should try to keep the area cleaner and a fresh coat of paint or wallpaper won't hurt either .Cooking - the quality of the cooking was uneven With the sashimi, tempura and agemono being handled with good skills. The yakimono was unacceptable , fried rice was tasteless , the teppanyaki beef not seasoned and tough and the grilled fish also not up to usual standard.On the whole, the experience was not unpleasant as service was good and price was not exorbitant but to claim to be a fine dining restaurant , I think all various sections of the kitchen should be of equal levels and not subject the patrons to possible hits and misses depending on what dishes they ordered Show less",3,Reviewed 29 June 2016 ,Ishin Japanese Dining
"ymt888Petaling Jaya, Malaysia",Nice lunch,"Had lunch here with a friend. The two of us ordered the sashimi platter which consisted on uni, fresh prawns, salmon belly, tuna, scallop. I love sashimi but was horrified to bite into a small portion of unfresh uni! This really needs improvement as freshness is absolutely the testament of a good Japanese restaurant.Also ordered my favorite tempura sweet potato. Love it as I love sweet potato. The baked oyster which we had was a disappointment though. Finale is the raindrop cake which is my first try and we both love that.Show less",3,Reviewed 27 June 2016 ,Ishin Japanese Dining
Chaw K,Japanese Dining at its Best,Michelin-licious!!! As good as you can get in Malaysia ...Ho chiak. Staff is attentive..I dropped my spoon and pick it up and left it... but the staff very quickly replaced it without my request...Love it!!!,5,Reviewed 25 June 2016 ,Ishin Japanese Dining
Cyndi L,Super delicious,"Came here with my old friends, the envirolment is cosy, the food is fresh and super delicious. The chef recommended sashimi is a must try item. A+++",5,Reviewed 24 June 2016 ,Ishin Japanese Dining
Iris C,Best Japanese restaurant ,"Being to many Japanese restaurants, so far this is the best. The sashimi is so fresh, as if I am eating in Japan. The waiters are friendly, especially the manager Mr Shon. Will definitely recommend my friends to come.",5,Reviewed 24 June 2016 ,Ishin Japanese Dining
simmonong,Fresh seafood n sashimi,Love the freshness of the food. Lives up its status as the best around KL. good ambience n friendly staff offering good service.,5,Reviewed 22 June 2016 ,Ishin Japanese Dining
Vin L,fresh sashimi and oyster,We have a wonderful dining experience. the food is fresh though it is a Wednesday. The place was packed. The oysters were fresh and huge! Love the sashimi and tempura.,5,Reviewed 22 June 2016 ,Ishin Japanese Dining
Cristy E,Authentic Japanese Cuisine! 👍,Amazing food! Freshest sashimi I ever had! Thick slices of different kinds high quality fish in a ice bowl that melts in your mouth. Very accommodating staff and very nice themed ambiance. Worth every penny spent. 100% satisfied.,5,Reviewed 16 June 2016 ,Ishin Japanese Dining
"DavidChewYuLinKuala Lumpur, Malaysia",Good Japanese fare,"Went there for a birthday dinner.Parking is a bit of an issue there, but they have a car-jockey that takes care of parking your car for you.The restaurant is nicely decorated and features a second floor, which I didn't go to since there was seating on the ground floor.Food was very good and of very high quality. I must recommend the omakase menu, whereby the chef whips out either 5 or 7 courses for you. Another must-try here is the grilled tuna jaw!Prices are a bit higher than other Japanese restaurants, but it's worth the treat!Show less",4,Reviewed 11 June 2016 ,Ishin Japanese Dining
Shima H,Fresh! and delicious,I don't normally order the unagi .. but damn that was so good! order the fresh wasabi instead of the normal one.,4,Reviewed 25 April 2016 ,Ishin Japanese Dining
limqingwei1993,Great place,"Good atmosphere and ambience, serving amazing food as well. Photographic images of the wide range of menu providing excellent idea of the food served. Friendly and attentive staff. Convenience of parking space and taxi services available via the staff as well",5,Reviewed 23 April 2016 ,Ishin Japanese Dining
Ling F,Happy Dinner with friends,"Feel happy dinner here, Very good service, good location, food  also yummy,green tea ,udon mee , kimcji soup and ice cream😘😘😘",5,Reviewed 22 April 2016 ,Ishin Japanese Dining
Gillian T,Nice Japanese food & Good Service,"1st time here, like the food very much!
Somemore got special offer buy 2 free 1 for dinner set☺
I will come again!",5,Reviewed 19 April 2016 ,Ishin Japanese Dining
JacquelineL2526,Hidden Gems in the neighbourhood!,"Fresh and good quality sashimi, pleasant staff and wonderful service. 
Quality Japanese food with Nice dining ambience and probably the best in old klang road!
Will definitely come again !",4,Reviewed 18 April 2016 ,Ishin Japanese Dining
"VivianeTongMuar, Malaysia",Overprice with So So Dining Experience,Food is just ok. Not too impressive and not really matched with the ranking #8.Overprice oyster @68/pcs which i could have gotten half dozen @ plenty of fine dining restaurant at Bangsar and really fresh too. Salmon belly sashimi is quite tasteless.Overall got quite disappointed when we went all the way to try it out. Show less,2,Reviewed 17 April 2016 ,Ishin Japanese Dining
Jason T,Good Service and Quality,Nice ambient and good service. Food is good too...Location is easy to spot and parking is easy. Will visit again definitely.,5,Reviewed 16 April 2016 ,Ishin Japanese Dining
Ernest W,Good Service,"First time here, food were a little slow but overall great atmosphere, excellent service. A small, almost hidden and quiet restaurant, great place to talk, for first date and etc.",4,Reviewed 15 April 2016 ,Ishin Japanese Dining
VeroniqueChuah,Good food,"Ordered the buy 2 free 1 set lunch. Good dining environment. Food is fresh and tasty.
Will definitely visit again.",4,Reviewed 15 April 2016 ,Ishin Japanese Dining
AiLingLow,Great food with good ambience,Fresh sashimi with reasonable price. Good environment and the staffs are attentive. Free parking services. Enjoy the set lunch very much.,4,Reviewed 15 April 2016 ,Ishin Japanese Dining
missalexial,Good ,"Good dining environment. Fresh food with reasonable price, specially the sashimi and sea urchin. Definitely will visit again.",5,Reviewed 14 April 2016 ,Ishin Japanese Dining
Lum Y,Good foood,Delicious dinner and good dining place with family.  Goood variety of foods and good service. Will come again.,4,Reviewed 12 April 2016 ,Ishin Japanese Dining
Angie C,Will come again ,"Great food, nice environment and really good service.  Sashimi very fresh. They are doing promotion for set dinner, buy 2 free 1.",5,Reviewed 12 April 2016 ,Ishin Japanese Dining
jayonholidays,Good dining experience and good food,"Good foood, ambience and good services. In addition, the restaurant is having a buy 2 free 1 for their lunch and dinner sets frm Mon to Thurs in this April.",4,Reviewed 12 April 2016 ,Ishin Japanese Dining
everncheah,Worth a visit ,Fresh sashimi with great service. Cozy environment. Will definitely come back again. Overall it was it great visit there.,4,Reviewed 7 April 2016 ,Ishin Japanese Dining
Derek H,Must try !,"Fresh sushi, good service and nice environment.  Feel satisfied about this restaurant. GOOD PLACE for gathering or dining.",5,Reviewed 3 April 2016 ,Ishin Japanese Dining
Elaine L,Happy things in life,"A first time for me to dine in Ishin Japanese Dining, I would say it's a good experience.  Good ambience, delicious food and attentive service.  Would definitely return to try other dishes.",5,Reviewed 3 April 2016 ,Ishin Japanese Dining
Elsa L,Gathering,Good food and friendly service. Prompt serving for order.  Quality of food upto expectation. Authentic Japanese cuisine.,5,Reviewed 3 April 2016 ,Ishin Japanese Dining
ruiyi90,Good food and good service,The food here taste good and worth coming. Staffs also very friendly and helpful. Recommended to come.,4,Reviewed 3 April 2016 ,Ishin Japanese Dining
Jia-Qi T,Good Food and Environment,Buy 2 get 1 free set lunch promotion is great value for money. Loved the teppanyaki set. Parking is convenient.,5,Reviewed 2 April 2016 ,Ishin Japanese Dining
yinyin0805,👍🏼👍🏼👍🏼,Nice services and very nice environment . I had a pleasant dining experience with food of the most exquisite flavours. For this reason I highly recommend going to the ishin japanese dining restaurant.,4,Reviewed 24 March 2016 ,Ishin Japanese Dining
"P87TKuala Lumpur, Malaysia","Nice japanese restaurant, sushi ok!","Craving for sushi I checked on TA a good place to go, Ishinis its close to Mid Valley a bit hidden on the main road...The place is nice and the food really really good, wide selection of sushi/sashimi/mains, nice to go with friend or couple...a bit quite..Show less",4,Reviewed 24 March 2016 ,Ishin Japanese Dining
Cindy T,Nice Japanese dinner ,Good ambience and ample parking. Food delicious..promotion now buy 2 free 1 for lunch and dinner set. One of the nice Japanese restaurant,4,Reviewed 22 March 2016 ,Ishin Japanese Dining
emily8828,Nicely Japanese Food and Ambiance ,We love the Japanese food with very fresh sashimi and Nicely Dinner Set and best service here... Now got Buy two free one for Dinner set.,4,Reviewed 22 March 2016 ,Ishin Japanese Dining
Ryan H,Nice food and enviroment,"Nice food, good service from the staff, recommended unagi avocado oshizushi , unajyu and also if come with family, recommended course dinner .Must try.",5,Reviewed 22 March 2016 ,Ishin Japanese Dining
Winnie L,Best unagi,Love the unagi avocado oshizushi and unajyu very much! Unagi lover should visit here. Non-unagi lover should try it too!,5,Reviewed 22 March 2016 ,Ishin Japanese Dining
Eunice L,Nice food,"Ishin the well known Japanese restaurant. This is not my fist time here. We enjoy the food, environment and services. The food presentation is fine and tasty. Fresh sashimi, wonderful lunch set. Employees are very polite and patient. The price are reasonable. We enjoy very much Show less",4,Reviewed 22 March 2016 ,Ishin Japanese Dining
Ryan_gaoyf,Nice Janpanese Food,"We love the food with very fresh sashimi 😁😁
And the best service here, very nice.
Now got buy two free one for lunch or dinner set!",5,Reviewed 21 March 2016 ,Ishin Japanese Dining
"Andrew4ableKuala Lumpur, Kuala Lumpur, Malaysia",Great food and ambiance,"A well diversed menu offering both authentic Japanese cuisine and some dishes with a slight localised twist to it. Service was quiet and quick. Employees are very polite and have good product knowledge. Only setback was that the place we were seated (upper floor) was a little hot yet it is tolerable.This is my second visit to the restaurant, recommend reservation for seats at the upper floor for a more quiet ambiance. Free valet parking is provided to curb the lack of parking space available around the restaurant. The portioning are relatively big, my family of 5 barely finish what we ordered (3 meal sets and a don).Show less",4,Reviewed 21 March 2016 ,Ishin Japanese Dining
Cheng S,"Nice ambience, even better food","The ambience  here is really nice paired with the relaxing music and friendly services. Plus, the food is fresh and tasty with reasonable prices.",5,Reviewed 20 March 2016 ,Ishin Japanese Dining
Mickey3381,Yummy food with fantastic service,"I have been to many Japanese restaurant and this one is one of my favourites. Tip top service coupled with quality food. If you miss Japan fresh sashimi, here is the place to be. Most of the ingredients are fresh and some even imported from Japan. You will never regretShow less",5,Reviewed 2 March 2016 ,Ishin Japanese Dining
"eeky888Kuala Lumpur, Malaysia",Delicious & very fresh sashimi,Very nice sashimi platter for 2 pax at RM 168. Fish portions were big and really fresh served with fresh grated wasabi. Had their lunch special of salmon belly teriyaki rice and it was so tender and aromatic. Yum ! The seasonal snails tasted like abalone. A great dining experience and will return.Show less,5,Reviewed 2 March 2016 ,Ishin Japanese Dining
Herbie L,Nice foods and big portion,"Nice foods and big portion, average price, But smelly as have open kitchen, good environment, have fine dinning feel...",4,Reviewed 1 March 2016 ,Ishin Japanese Dining
Gensy C,Wonderful dining experience,"Really like the food and the way they organize and present it. Fresh sashimi with best wagyu and unagi :) not forgetting the appetizer with urchin with sweet tomato, definitely one of the best japanese dining experience in ishin. Thumbs up!",5,Reviewed 1 March 2016 ,Ishin Japanese Dining
556serenel,Best dinner,Wonderful experience to have dinner here. Kids just love it. Foods are fresh and services are good. Value for money. I will definitely coming back again.,5,Reviewed 25 February 2016 ,Ishin Japanese Dining
Emy C,Nice Food & Friendly Service,"The serving attitude of the captain is perfect. And, food is fantastic! I will be here again and again! Show less",5,Reviewed 24 February 2016 ,Ishin Japanese Dining
Nightgenesis,Fabulous dine!,"1st time visiting here! Food is fresh & good, serving is welcoming and atmosphere is cosy. Definitely a place NOT TO BE MISS! Highly recommended!",4,Reviewed 24 February 2016 ,Ishin Japanese Dining
shinnie w,Excellent,Great experience. The food is nice and the place is clean abd tidy. The waiters are polite and helpful.,5,Reviewed 23 February 2016 ,Ishin Japanese Dining
passielees,Excellent ,Nice food and love the ambience here. The waiters are polite and helpful. Will definitely come back for next visit and bring along friends.,5,Reviewed 23 February 2016 ,Ishin Japanese Dining
izumidac,Oiishi ne,"YUMMY ..... fresh , taste Great , Great services , Comfortable place , Prices also reasonable , parking is easy. will come again soon
Is good for gathering also",5,Reviewed 23 February 2016 ,Ishin Japanese Dining
Daniel T,Cozy environment & friendly service ,"1st time here. Very satisfied with the quality Japanese food here. Taste very good. 

Love the cozy environment and staff services. Prompt and attempted. 

Will recommend to my friends to visit Ishin",4,Reviewed 22 February 2016 ,Ishin Japanese Dining
600chewh,Dinner,"The food is delicious. I like the dragon roll, the unagi is very tasty. Service friendly. Ambiance is decent.",4,Reviewed 22 February 2016 ,Ishin Japanese Dining
Rachael T,Great fresh sashimi in KL,"Great place with great atmosphere , the sashimi was very fresh and nicely presented , staff with good manners and excellent service . Highly recommended",5,Reviewed 22 February 2016 ,Ishin Japanese Dining
SeanA1584,Best Japanese Restaurant ever,Visited here 5 years ago and still as fresh as I tasted before. Definitely would come back again whenever I visit KL and crave for Japanese food.,5,Reviewed 22 February 2016 ,Ishin Japanese Dining
BabieW1,Nice restaurant ,"It's  been so long i had visited such a nice restaurant. Friendly person, good service,  good food, reasonable price and a definitely must try restaurant!!!",5,Reviewed 20 February 2016 ,Ishin Japanese Dining
Koh Z,Dinner with family,The food here is really delicious and the fishes is really taste good and fresh. I had a great dinner here and the service is good.,5,Reviewed 20 February 2016 ,Ishin Japanese Dining
Anita H,Good value for money,"Nice food and atmosphere, wonderful night!  The  food was great and the service was also very good. Will definitely return again.",4,Reviewed 20 February 2016 ,Ishin Japanese Dining
